{
  "$schema": "http://json-schema.org/draft-07/schema",
  "$id": "https://www.alpinebits.org/destinationdata/schemas/2022-04/mediaObject",
  "description": "A resource that implements the concept of Media Object defined in the AlpineBitsÂ® DestinationData Ontology.",
  "type": "object",
  "additionalProperties": false,
  "required": ["type"],
  "properties": {
    "id": {
      "$ref": "/destinationdata/schemas/2022-04/datatypes#/definitions/id"
    },
    "type": {
      "const": "mediaObjects"
    },
    "meta": {
      "$ref": "/destinationdata/schemas/2022-04/datatypes#/definitions/meta"
    },
    "links": {
      "$ref": "/destinationdata/schemas/2022-04/datatypes#/definitions/links"
    },
    "attributes": {
      "type": "object",
      "additionalProperties": false,
      "properties": {
        "abstract": {
          "oneOf": [
            {
              "type": "null"
            },
            {
              "$ref": "/destinationdata/schemas/2022-04/datatypes#/definitions/text"
            }
          ]
        },
        "author": {
          "type": [ "null", "string" ],
          "minLength": 1
        },
        "contentType": {
          "type": "string",
          "pattern": "^(application|audio|font|example|image|message|model|multipart|text|video)/[a-zA-Z0-9-.+]+$"
        },
        "description": {
          "oneOf": [
            {
              "type": "null"
            },
            {
              "$ref": "/destinationdata/schemas/2022-04/datatypes#/definitions/text"
            }
          ]
        },
        "duration": {
          "type": [ "null", "integer" ],
          "exclusiveMinimum": 0
        },
        "height": {
          "type": [ "null", "integer" ],
          "exclusiveMinimum": 0
        },
        "license": {
          "type": [ "null", "string" ],
          "minLength": 1
        },
        "name": {
          "oneOf": [
            {
              "type": "null"
            },
            {
              "$ref": "/destinationdata/schemas/2022-04/datatypes#/definitions/text"
            }
          ]
        },
        "shortName": {
          "oneOf": [
            {
              "type": "null"
            },
            {
              "$ref": "/destinationdata/schemas/2022-04/datatypes#/definitions/text"
            }
          ]
        },
        "url": {
          "$ref": "/destinationdata/schemas/2022-04/datatypes#/definitions/url"
        },
        "width": {
          "type": [ "null", "integer" ],
          "exclusiveMinimum": 0
        }
      }
    },
    "relationships": {
      "type": "object",
      "additionalProperties": false,
      "properties": {
        "categories": {
          "oneOf": [
            {
              "type": "null"
            },
            {
              "$ref": "/destinationdata/schemas/2022-04/datatypes#/definitions/relationshipToMany"
            }
          ]
        },
        "licenseHolder": {
          "oneOf": [
            {
              "type": "null"
            },
            {
              "$ref": "/destinationdata/schemas/2022-04/datatypes#/definitions/relationshipToOne"
            }
          ]
        }
      }
    }
  }
}
